name,ring,quadrant,isNew,description
Webpack,adopt,libraries,FALSE,"Generic, eats it all web asset bundler"
Rollup,adopt,libraries,FALSE,"Efficient web asset bundler"
Browserify,hold,libraries,FALSE,"CommonJS module bundler"
ESLint,adopt,v,FALSE,"JavaScript linter"
Mocha,adopt,libraries,FALSE,"JavaScript test framework"
Codecov,adopt,tools,FALSE,"Code coverage reporting, integrated into our development flow"
Travis CI,adopt,tools,FALSE,"Cloud CI, tightly integrated into GitHub"
JavaScript,adopt,languages & frameworks,FALSE,"The language of the web"
TypeScript,assess,languages & frameworks,FALSE,"The language of the web, typed"
